<?xml version="1.0" encoding="UTF-8"?>
<?xml-stylesheet type="text/xsl" href="documenti.xsl" ?>

<ts:testi xmlns:xs="http://www.w3.org/2001/XMLSchema-instance" xmlns="http://www.documenti.com" xs:schemaLocation="http://www.documenti.com documenti.xsd" xmlns:ts="http://www.documenti.com">
	<documento>
		<titolo>DICHIARAZIONE DI SPESE</titolo>
		<paragrafo>Documento che permette di dichiarare le spese di iscrizione ai corsi del Circolo di Scherma di Castelfranco Veneto.</paragrafo>
		<doc-completo>../document/dichiarazione-spese.pdf</doc-completo>
		<dimensione>159</dimensione>
	</documento>

	<documento>
		<titolo>REGOLAMENTO INTERNO</titolo>
		<paragrafo>Disponibile il regolamento interno del Circolo, contenente le regole di comportamento e il ruolo dei vari organi dell'associazione.</paragrafo>
		<doc-completo>../document/regolamento-interno.pdf</doc-completo>
		<dimensione>246</dimensione>
	</documento>


</ts:testi>
